{
  "$schema": "../../src/shim/plugin/plugin-manifest.schema.json",
  "id": "openapi",
  "name": "OpenAPI",
  "version": "1.0.0",
  "description": "Imports OpenAPI 3 and Swagger 2 documents.",
  "engine": "^1.0.0",
  "permissions": ["fs:pick"],
  "contributes": {
    "importers": [{ "id": "document", "name": "OpenAPI", "extensions": ["json", "yaml", "yml"] }]
  }
}
